{
  "closure_version": "MHAI-CLOSURE-EPOCH-2",
  "epoch_id": "closure-1784468643-4afb5d72974d",
  "git_read_contract": {
    "argument": "git --no-optional-locks",
    "environment": "GIT_OPTIONAL_LOCKS=0"
  },
  "historical_exception_repaired": false,
  "historical_exceptions": [
    "SE-001",
    "SE-002",
    "SE-003"
  ],
  "lane_discovery": {
    "browser": {
      "detail": "Locally cached candidates failed repeatable bounded launcher qualification; CQ-012 must retain hard refusal.",
      "eligible": false
    },
    "cross_sdk": {
      "detail": "Qualified cached image contains Python mcp 1.28.1 and TypeScript @modelcontextprotocol/sdk 1.29.0.",
      "eligible": true
    },
    "go_sdk": {
      "cached_image_results": [
        {
          "exact_module_matches": 0,
          "image": "ghcr.io/astral-sh/uv:0.8.15",
          "scan_result": "UNAVAILABLE"
        },
        {
          "exact_module_matches": 0,
          "image": "mcp-trust-batch3:20260703",
          "scan_result": "PASS"
        },
        {
          "exact_module_matches": 0,
          "image": "mcp-trust-batch4:20260703",
          "scan_result": "PASS"
        },
        {
          "exact_module_matches": 0,
          "image": "mcp-trust-live-batch:20260628",
          "scan_result": "PASS"
        },
        {
          "exact_module_matches": 0,
          "image": "mcp-trust-scan:corpus-2026-07-03",
          "scan_result": "PASS"
        },
        {
          "exact_module_matches": 0,
          "image": "node:22-slim",
          "scan_result": "PASS"
        },
        {
          "exact_module_matches": 0,
          "image": "node:24-slim",
          "scan_result": "PASS"
        }
      ],
      "cached_images_considered": 7,
      "detail": "No exact official github.com/modelcontextprotocol/go-sdk version exists in the bounded host module cache or inspectable cached images; any unavailable image remains an explicit access limitation.",
      "eligible": false,
      "host_exact_versions": [],
      "host_go_mod_files_scanned": 1,
      "image_exact_module_matches": 0,
      "network_access_used": false,
      "package_install_used": false,
      "unavailable_images": [
        "ghcr.io/astral-sh/uv:0.8.15"
      ]
    },
    "type_checker": {
      "detail": "mypy 2.0.0 is installed locally.",
      "eligible": true
    }
  },
  "opened_at": "2026-07-19T13:44:31.655066Z",
  "phase": "OPEN",
  "program_commit": "a83da9dc6e6d76e32e46e717ad959c488f839424",
  "target_observations": [
    {
      "archive": {
        "created": false,
        "fidelity_proven": false,
        "reason": "source ownership is not clear"
      },
      "branch": "main",
      "case_ids": [
        "RT-012"
      ],
      "clean": false,
      "head": "2e6b0ddf4d16ec910eb44eec4b324158e0a79ce3",
      "metadata": {
        "git_entry_count": 8382,
        "git_metadata_sha256": "9cc76093d0d7f94741fa155c2ec3ad56a62b6d014e07cb98e1f51154511c3e00",
        "git_scope": "included-in-worktree",
        "index": {
          "inode": 227310641,
          "mtime_ns": 1784458294964914612,
          "size": 11904
        },
        "worktree_entry_count": 8382,
        "worktree_metadata_sha256": "9cc76093d0d7f94741fa155c2ec3ad56a62b6d014e07cb98e1f51154511c3e00"
      },
      "name": "mcp-trust",
      "ownership": "UNCLEAR",
      "ownership_basis": "The worktree is not approved as disposable source, and current ownership is not proven.",
      "read_mutation_free": true,
      "status_sha256": "8caea121d7264dd2e3c2c571eed821d77fbba49ed3bb260a6f7e064f925d1a06",
      "tree": "d602e7feee52a988d2c0c050e936fe40884f89a1"
    },
    {
      "archive": {
        "created": false,
        "fidelity_proven": false,
        "reason": "source ownership is not clear"
      },
      "branch": "fix/serde-with-ghsa-7gcf-g7xr-8hxj",
      "case_ids": [
        "HC-011",
        "HC-012"
      ],
      "clean": true,
      "head": "772be25eed8554defa55505cadd23e7fc61df982",
      "metadata": {
        "git_entry_count": 8131,
        "git_metadata_sha256": "d349d2496b0f8204a476d8359da72550667f5cf4d9e22e2481a538f0f5379d05",
        "git_scope": "included-in-worktree",
        "index": {
          "inode": 225864915,
          "mtime_ns": 1784448355780507425,
          "size": 5907
        },
        "worktree_entry_count": 8131,
        "worktree_metadata_sha256": "d349d2496b0f8204a476d8359da72550667f5cf4d9e22e2481a538f0f5379d05"
      },
      "name": "PortfolioCommandCenter",
      "ownership": "UNCLEAR",
      "ownership_basis": "Clean source exists on a security-fix branch, but current branch ownership is not proven.",
      "read_mutation_free": true,
      "status_sha256": "e3b0c44298fc1c149afbf4c8996fb92427ae41e4649b934ca495991b7852b855",
      "tree": "e86aa28de7d2456dffb60f38f774e14f62f56731"
    },
    {
      "archive": {
        "created": false,
        "fidelity_proven": false,
        "reason": "source ownership is not clear"
      },
      "branch": "codex/fix/serde-with-ghsa-7gcf-g7xr-8hxj",
      "case_ids": [
        "LP-007"
      ],
      "clean": true,
      "head": "09c3aa435a608d03c002782e6268c10f5bb7fe94",
      "metadata": {
        "git_entry_count": 762,
        "git_metadata_sha256": "c76b65b86fba8576d0f330d4dcef368ac07f690344a60088f5ac52a3ebe7b8ab",
        "git_scope": "included-in-worktree",
        "index": {
          "inode": 225269680,
          "mtime_ns": 1784445971901788889,
          "size": 26693
        },
        "worktree_entry_count": 762,
        "worktree_metadata_sha256": "c76b65b86fba8576d0f330d4dcef368ac07f690344a60088f5ac52a3ebe7b8ab"
      },
      "name": "AIGCCore",
      "ownership": "UNCLEAR",
      "ownership_basis": "Clean source exists on a security-fix branch, but current branch ownership is not proven.",
      "read_mutation_free": true,
      "status_sha256": "e3b0c44298fc1c149afbf4c8996fb92427ae41e4649b934ca495991b7852b855",
      "tree": "e89ae646ceb8932ac88a3f0bb27fcd8bedd95798"
    },
    {
      "archive": {
        "created": false,
        "fidelity_proven": false,
        "reason": "source ownership is not clear"
      },
      "branch": "feat/wave3-accretive",
      "case_ids": [
        "LP-009"
      ],
      "clean": false,
      "head": "eb17854731c6cadcdc5a01a318439667e085f957",
      "metadata": {
        "git_entry_count": 11,
        "git_metadata_sha256": "c2f0865ef8598439554d2de1efe984774bce9c2980fc6a05e79e36832ceaf6ff",
        "git_scope": "linked-worktree-gitdir",
        "index": {
          "inode": 230158110,
          "mtime_ns": 1784467814256749769,
          "size": 93823
        },
        "worktree_entry_count": 999,
        "worktree_metadata_sha256": "6fe547edb835c5556096b233245f0cf49e792996a882c8ed2c5ed83e67352718"
      },
      "name": "portfolio-index",
      "ownership": "ACTIVE",
      "ownership_basis": "The shared portfolio-index worktree has an active owner; no clean ownership window is authorized.",
      "read_mutation_free": true,
      "status_sha256": "7892fbcb9308bd19a531a8988c340b8ac8ec710a21c2a41c2b649c5b24c04089",
      "tree": "d7e7aab8e64d2a37ece219020e6a16cdea673e31"
    }
  ]
}
