{
  "closure_version": "MHAI-CLOSURE-EPOCH-2",
  "epoch_id": "closure-1784461445-0f3f973ae17a",
  "git_read_contract": {
    "argument": "git --no-optional-locks",
    "environment": "GIT_OPTIONAL_LOCKS=0"
  },
  "historical_exception_repaired": false,
  "historical_exceptions": [
    "SE-001"
  ],
  "lane_discovery": {
    "browser": {
      "detail": "No browser executable exists in the cached containment image; the normal host Chrome profile remains forbidden.",
      "eligible": false
    },
    "cross_sdk": {
      "detail": "Qualified cached image contains Python mcp 1.28.1 and TypeScript @modelcontextprotocol/sdk 1.29.0.",
      "eligible": true
    },
    "go_sdk": {
      "detail": "No exact official Go MCP SDK exists in the bounded local caches.",
      "eligible": false
    },
    "type_checker": {
      "detail": "mypy 2.0.0 is installed locally.",
      "eligible": true
    }
  },
  "opened_at": "2026-07-19T11:44:09.597499Z",
  "phase": "OPEN",
  "program_commit": "92e3de5d14686488b124eb4194145e053e33aa93",
  "target_observations": [
    {
      "archive": {
        "created": false,
        "fidelity_proven": false,
        "reason": "source ownership is not clear"
      },
      "branch": "main",
      "case_ids": [
        "RT-012"
      ],
      "clean": false,
      "head": "2e6b0ddf4d16ec910eb44eec4b324158e0a79ce3",
      "metadata": {
        "git_entry_count": 8352,
        "git_metadata_sha256": "ca73a5e2be9e72ecab525e7505d238bd8266519860d902cd23e78a0ef1ec4683",
        "git_scope": "included-in-worktree",
        "index": {
          "inode": 227310641,
          "mtime_ns": 1784458294964914612,
          "size": 11904
        },
        "worktree_entry_count": 8352,
        "worktree_metadata_sha256": "ca73a5e2be9e72ecab525e7505d238bd8266519860d902cd23e78a0ef1ec4683"
      },
      "name": "mcp-trust",
      "ownership": "UNCLEAR",
      "ownership_basis": "The source changed during the preceding closure window, so current ownership is not proven.",
      "read_mutation_free": true,
      "status_sha256": "8caea121d7264dd2e3c2c571eed821d77fbba49ed3bb260a6f7e064f925d1a06",
      "tree": "d602e7feee52a988d2c0c050e936fe40884f89a1"
    },
    {
      "archive": {
        "created": false,
        "fidelity_proven": false,
        "reason": "source ownership is not clear"
      },
      "branch": "fix/serde-with-ghsa-7gcf-g7xr-8hxj",
      "case_ids": [
        "HC-011",
        "HC-012"
      ],
      "clean": true,
      "head": "772be25eed8554defa55505cadd23e7fc61df982",
      "metadata": {
        "git_entry_count": 8131,
        "git_metadata_sha256": "89d99e17dd6c290fa8dac5a3aaace021a41fbd324488cbd3bb54928baa38d19a",
        "git_scope": "included-in-worktree",
        "index": {
          "inode": 225864915,
          "mtime_ns": 1784448355780507425,
          "size": 5907
        },
        "worktree_entry_count": 8131,
        "worktree_metadata_sha256": "89d99e17dd6c290fa8dac5a3aaace021a41fbd324488cbd3bb54928baa38d19a"
      },
      "name": "PortfolioCommandCenter",
      "ownership": "UNCLEAR",
      "ownership_basis": "Clean source exists on a security-fix branch, but current branch ownership is not proven.",
      "read_mutation_free": true,
      "status_sha256": "e3b0c44298fc1c149afbf4c8996fb92427ae41e4649b934ca495991b7852b855",
      "tree": "e86aa28de7d2456dffb60f38f774e14f62f56731"
    },
    {
      "archive": {
        "created": false,
        "fidelity_proven": false,
        "reason": "source ownership is not clear"
      },
      "branch": "codex/fix/serde-with-ghsa-7gcf-g7xr-8hxj",
      "case_ids": [
        "LP-007"
      ],
      "clean": true,
      "head": "09c3aa435a608d03c002782e6268c10f5bb7fe94",
      "metadata": {
        "git_entry_count": 762,
        "git_metadata_sha256": "a5314f8b3698ce27a6571dc5466039979437b7a65c9da91398ccceebdc6b5211",
        "git_scope": "included-in-worktree",
        "index": {
          "inode": 225269680,
          "mtime_ns": 1784445971901788889,
          "size": 26693
        },
        "worktree_entry_count": 762,
        "worktree_metadata_sha256": "a5314f8b3698ce27a6571dc5466039979437b7a65c9da91398ccceebdc6b5211"
      },
      "name": "AIGCCore",
      "ownership": "UNCLEAR",
      "ownership_basis": "Clean source exists on a security-fix branch, but current branch ownership is not proven.",
      "read_mutation_free": true,
      "status_sha256": "e3b0c44298fc1c149afbf4c8996fb92427ae41e4649b934ca495991b7852b855",
      "tree": "e89ae646ceb8932ac88a3f0bb27fcd8bedd95798"
    },
    {
      "archive": {
        "created": false,
        "fidelity_proven": false,
        "reason": "source ownership is not clear"
      },
      "branch": "feat/wave2-signature",
      "case_ids": [
        "LP-009"
      ],
      "clean": false,
      "head": "150ed52ea906059103dbcfec709d4d2fde86389e",
      "metadata": {
        "git_entry_count": 11,
        "git_metadata_sha256": "98588ece158a4af73a8b58c0a3a37efc063003b461676f92f1e6fb0f437aa977",
        "git_scope": "linked-worktree-gitdir",
        "index": {
          "inode": 228338923,
          "mtime_ns": 1784461055548739846,
          "size": 93155
        },
        "worktree_entry_count": 992,
        "worktree_metadata_sha256": "f3932b818ef9cb481b78b1e00d5f54279e612ebc9417f69e94e85c7ab0b434dc"
      },
      "name": "portfolio-index",
      "ownership": "ACTIVE",
      "ownership_basis": "The shared worktree moved to feat/wave2-signature after the prior closeout.",
      "read_mutation_free": true,
      "status_sha256": "51d8a43b7450ef870803f6fa129a643f5b83817ee3a6bfd1dbb9aa35c5b845ff",
      "tree": "9ad9353e2a896d0f244edceba0206dbcd238cd26"
    }
  ]
}
